{
  "$schema": "https://github.com/Emily2040/seedance-2.0/schemas/binding-plan.schema.json",
  "schema_version": 1,
  "profile_id": "byteplus.modelark",
  "operation": "reference_generation",
  "segments": [
    {"kind": "binding", "binding_id": "product"},
    {"kind": "text", "value": " controls product geometry; preserve its label and proportions."}
  ],
  "bindings": [
    {
      "binding_id": "product",
      "media_type": "image",
      "prompt_visible_handle": "@Image 1"
    }
  ]
}
